### ISSUE TITLE
initial call to api times out

### ISSUE THREAD

**Issue by bfeeny** [cloudfoundry/cli#412]
I am using Pivotal CF.  Ops Mgr 1.3.4.0 and Elastic Runtime 1.3.5.0.

 I noticed during installation of Elastic Runtime, smoke-tests errand fails.  I did a complete install without the smoke test, and then manually kicked it off.  It fails on its initial request to the api.  Subsequent requests succeed.  I can reproduce this at will.

On the director, I fire off a smoke tests errand:

tempest@tempest:~$ bosh run errand smoke-tests

This fails, because it fails when trying to connect to the api.

Logging into the VM, I see the IP address resolves properly to the API, and its pingable.  Here is an example of what I see:

vcap@57696554-f4c4-4fff-a0b6-45b70755dc32:~$ /var/vcap/packages/cli/bin/cf api https://api.cf.lab.local --skip-ssl-validation 

VERSION:
6.5.1-4aaf45f

Setting api endpoint to https://api.cf.lab.local...

REQUEST: [2015-04-15T00:47:02Z]
GET /v2/info HTTP/1.1
Host: api.cf.lab.local
Accept: application/json
Content-Type: application/json
User-Agent: go-cli 6.5.1-4aaf45f / linux

FAILED
i/o timeout
FAILED
i/o timeout
vcap@57696554-f4c4-4fff-a0b6-45b70755dc32:~$ /var/vcap/packages/cli/bin/cf api https://api.cf.lab.local --skip-ssl-validation 

VERSION:
6.5.1-4aaf45f

Setting api endpoint to https://api.cf.lab.local...

REQUEST: [2015-04-15T00:47:08Z]
GET /v2/info HTTP/1.1
Host: api.cf.lab.local
Accept: application/json
Content-Type: application/json
User-Agent: go-cli 6.5.1-4aaf45f / linux

RESPONSE: [2015-04-15T00:47:08Z]
HTTP/1.1 200 OK
Content-Length: 314
Content-Type: application/json;charset=utf-8
Date: Wed, 15 Apr 2015 00:47:08 GMT
Keep-Alive: timeout=20
Server: nginx
X-Cf-Requestid: 81bc27ea-64a0-466a-4ce0-fe649bd722e3
X-Content-Type-Options: nosniff
X-Vcap-Request-Id: 1279aeee-a525-46bd-523e-44d4f4caa2e9::8d9ed890-ca37-4541-b9d3-44ac3d54fdd0

{"name":"vcap","build":"2222","support":"http://support.cloudfoundry.com","version":2,"description":"Cloud Foundry sponsored by Pivotal","authorization_endpoint":"https://login.cf.lab.local","token_endpoint":"https://uaa.cf.lab.local","api_version":"2.13.0","logging_endpoint":"wss://loggregator.cf.lab.local:443"}
OK

                   
API endpoint:   https://api.cf.lab.local (API version: 2.13.0)   
Not logged in. Use 'cf login' to log in.

You can see that the first call fails, I immediately re-run the same command and it succeeds.  I googled on this issue and it seems some people claimed different versions of the cf cli may fix the issue.  My system being Pivotal CF comes with 6.5.1-4aaf45f so I am trying to see if this is an issue with the CLI or with something else going on.

**Comment by bfeeny** [comment]
I am listing a tcpdump that shows 3 failures and one success of the command:

/var/vcap/packages/cli/bin/cf api https://api.cf.lab.local --skip-ssl-validation 

Ran from the smoke-tests errand VM.  I am hoping that this tcpdump tells some helpful information of what may be going on.

vcap@74830a45-1b8a-40d4-8b85-58a628e625e5:~$ sudo tcpdump -i eth0 port not 22
[sudo] password for vcap: 
tcpdump: verbose output suppressed, use -v or -vv for full protocol decode
listening on eth0, link-type EN10MB (Ethernet), capture size 65535 bytes
01:34:01.359071 IP 172.16.201.4.4222 > 0.smoke-tests.default.cf-95df4eaf877af001f0b2.microbosh.38288: Flags [P.], seq 2001863459:2001863685, ack 108285397, win 626, options [nop,nop,TS val 4352487 ecr 4294902798], length 226
01:34:01.359111 IP 0.smoke-tests.default.cf-95df4eaf877af001f0b2.microbosh.38288 > 172.16.201.4.4222: Flags [.], ack 226, win 1169, options [nop,nop,TS val 4294903038 ecr 4352487], length 0
01:34:01.359837 IP 0.smoke-tests.default.cf-95df4eaf877af001f0b2.microbosh.38288 > 172.16.201.4.4222: Flags [P.], seq 1:178, ack 226, win 1169, options [nop,nop,TS val 4294903038 ecr 4352487], length 177
01:34:01.360754 IP 172.16.201.4.4222 > 0.smoke-tests.default.cf-95df4eaf877af001f0b2.microbosh.38288: Flags [P.], seq 226:231, ack 178, win 643, options [nop,nop,TS val 4352487 ecr 4294903038], length 5
01:34:01.400790 IP 0.smoke-tests.default.cf-95df4eaf877af001f0b2.microbosh.38288 > 172.16.201.4.4222: Flags [.], ack 231, win 1169, options [nop,nop,TS val 4294903049 ecr 4352487], length 0
01:34:01.402385 IP 0.smoke-tests.default.cf-95df4eaf877af001f0b2.microbosh.51427 > 172.16.200.2.domain: 55480+ PTR? 24.201.16.172.in-addr.arpa. (44)
01:34:01.404768 IP 172.16.200.2.domain > 0.smoke-tests.default.cf-95df4eaf877af001f0b2.microbosh.51427: 55480* 1/0/0 PTR 0.smoke-tests.default.cf-95df4eaf877af001f0b2.microbosh. (113)
01:34:01.404940 IP 0.smoke-tests.default.cf-95df4eaf877af001f0b2.microbosh.58287 > 172.16.200.2.domain: 21927+ PTR? 4.201.16.172.in-addr.arpa. (43)
01:34:01.406143 IP 172.16.200.2.domain > 0.smoke-tests.default.cf-95df4eaf877af001f0b2.microbosh.58287: 21927 NXDomain* 0/1/0 (99)
01:34:02.023061 ARP, Request who-has 0.smoke-tests.default.cf-95df4eaf877af001f0b2.microbosh (Broadcast) tell 0.smoke-tests.default.cf-95df4eaf877af001f0b2.microbosh, length 28
01:34:02.362645 IP 172.16.201.4.4222 > 0.smoke-tests.default.cf-95df4eaf877af001f0b2.microbosh.38288: Flags [P.], seq 231:457, ack 178, win 643, options [nop,nop,TS val 4352738 ecr 4294903049], length 226
01:34:02.362684 IP 0.smoke-tests.default.cf-95df4eaf877af001f0b2.microbosh.38288 > 172.16.201.4.4222: Flags [.], ack 457, win 1206, options [nop,nop,TS val 4294903289 ecr 4352738], length 0
01:34:02.363273 IP 0.smoke-tests.default.cf-95df4eaf877af001f0b2.microbosh.38288 > 172.16.201.4.4222: Flags [P.], seq 178:355, ack 457, win 1206, options [nop,nop,TS val 4294903289 ecr 4352738], length 177
01:34:02.363791 IP 172.16.201.4.4222 > 0.smoke-tests.default.cf-95df4eaf877af001f0b2.microbosh.38288: Flags [P.], seq 457:462, ack 355, win 661, options [nop,nop,TS val 4352738 ecr 4294903289], length 5
01:34:02.400660 IP 0.smoke-tests.default.cf-95df4eaf877af001f0b2.microbosh.38288 > 172.16.201.4.4222: Flags [.], ack 462, win 1206, options [nop,nop,TS val 4294903299 ecr 4352738], length 0
01:34:02.400911 IP 0.smoke-tests.default.cf-95df4eaf877af001f0b2.microbosh.43177 > 172.16.200.2.domain: 37391+ PTR? 2.200.16.172.in-addr.arpa. (43)
01:34:02.403144 IP 172.16.201.4.domain > 0.smoke-tests.default.cf-95df4eaf877af001f0b2.microbosh.43177: 37391 NXDomain* 0/1/0 (97)
01:34:02.403169 IP 0.smoke-tests.default.cf-95df4eaf877af001f0b2.microbosh > 172.16.201.4: ICMP 0.smoke-tests.default.cf-95df4eaf877af001f0b2.microbosh udp port 43177 unreachable, length 133
01:34:02.502123 IP 0.smoke-tests.default.cf-95df4eaf877af001f0b2.microbosh.59830 > 172.16.200.2.domain: 43755+ A? api.cf.lab.local. (34)
01:34:02.502135 IP 0.smoke-tests.default.cf-95df4eaf877af001f0b2.microbosh.59830 > 172.16.200.2.domain: 9199+ AAAA? api.cf.lab.local. (34)
01:34:02.503427 IP 172.16.201.4.domain > 0.smoke-tests.default.cf-95df4eaf877af001f0b2.microbosh.59830: 43755* 1/1/1 A 172.16.201.5 (83)
01:34:02.503450 IP 0.smoke-tests.default.cf-95df4eaf877af001f0b2.microbosh > 172.16.201.4: ICMP 0.smoke-tests.default.cf-95df4eaf877af001f0b2.microbosh udp port 59830 unreachable, length 119
01:34:02.503517 IP 172.16.201.4.domain > 0.smoke-tests.default.cf-95df4eaf877af001f0b2.microbosh.59830: 9199* 0/1/0 (78)
01:34:02.503529 IP 0.smoke-tests.default.cf-95df4eaf877af001f0b2.microbosh > 172.16.201.4: ICMP 0.smoke-tests.default.cf-95df4eaf877af001f0b2.microbosh udp port 59830 unreachable, length 114
01:34:03.364718 IP 172.16.201.4.4222 > 0.smoke-tests.default.cf-95df4eaf877af001f0b2.microbosh.38288: Flags [P.], seq 462:688, ack 355, win 661, options [nop,nop,TS val 4352988 ecr 4294903299], length 226
01:34:03.364728 IP 0.smoke-tests.default.cf-95df4eaf877af001f0b2.microbosh.38288 > 172.16.201.4.4222: Flags [.], ack 688, win 1243, options [nop,nop,TS val 4294903540 ecr 4352988], length 0
01:34:03.365102 IP 0.smoke-tests.default.cf-95df4eaf877af001f0b2.microbosh.38288 > 172.16.201.4.4222: Flags [P.], seq 355:532, ack 688, win 1243, options [nop,nop,TS val 4294903540 ecr 4352988], length 177
01:34:03.365411 IP 172.16.201.4.4222 > 0.smoke-tests.default.cf-95df4eaf877af001f0b2.microbosh.38288: Flags [P.], seq 688:693, ack 532, win 678, options [nop,nop,TS val 4352988 ecr 4294903540], length 5
01:34:03.404803 IP 0.smoke-tests.default.cf-95df4eaf877af001f0b2.microbosh.38288 > 172.16.201.4.4222: Flags [.], ack 693, win 1243, options [nop,nop,TS val 4294903550 ecr 4352988], length 0
01:34:04.098096 IP 172.16.201.4.4222 > 0.smoke-tests.default.cf-95df4eaf877af001f0b2.microbosh.38288: Flags [P.], seq 693:699, ack 532, win 678, options [nop,nop,TS val 4353171 ecr 4294903550], length 6
01:34:04.098134 IP 0.smoke-tests.default.cf-95df4eaf877af001f0b2.microbosh.38288 > 172.16.201.4.4222: Flags [.], ack 699, win 1243, options [nop,nop,TS val 4294903723 ecr 4353171], length 0
01:34:04.098265 IP 0.smoke-tests.default.cf-95df4eaf877af001f0b2.microbosh.38288 > 172.16.201.4.4222: Flags [P.], seq 532:538, ack 699, win 1243, options [nop,nop,TS val 4294903723 ecr 4353171], length 6
01:34:04.138481 IP 172.16.201.4.4222 > 0.smoke-tests.default.cf-95df4eaf877af001f0b2.microbosh.38288: Flags [.], ack 538, win 678, options [nop,nop,TS val 4353182 ecr 4294903723], length 0
01:34:04.366881 IP 172.16.201.4.4222 > 0.smoke-tests.default.cf-95df4eaf877af001f0b2.microbosh.38288: Flags [P.], seq 699:925, ack 538, win 678, options [nop,nop,TS val 4353239 ecr 4294903723], length 226
01:34:04.367362 IP 0.smoke-tests.default.cf-95df4eaf877af001f0b2.microbosh.38288 > 172.16.201.4.4222: Flags [P.], seq 538:650, ack 925, win 1279, options [nop,nop,TS val 4294903790 ecr 4353239], length 112
01:34:04.368046 IP 172.16.201.4.4222 > 0.smoke-tests.default.cf-95df4eaf877af001f0b2.microbosh.38288: Flags [.], ack 650, win 678, options [nop,nop,TS val 4353239 ecr 4294903790], length 0
01:34:04.368077 IP 172.16.201.4.4222 > 0.smoke-tests.default.cf-95df4eaf877af001f0b2.microbosh.38288: Flags [P.], seq 925:930, ack 650, win 678, options [nop,nop,TS val 4353239 ecr 4294903790], length 5
01:34:04.370844 IP 172.16.201.4.4222 > 0.smoke-tests.default.cf-95df4eaf877af001f0b2.microbosh.38288: Flags [P.], seq 930:1115, ack 650, win 678, options [nop,nop,TS val 4353240 ecr 4294903790], length 185
01:34:04.370890 IP 0.smoke-tests.default.cf-95df4eaf877af001f0b2.microbosh.38288 > 172.16.201.4.4222: Flags [.], ack 1115, win 1316, options [nop,nop,TS val 4294903791 ecr 4353239], length 0
01:34:04.372902 IP 0.smoke-tests.default.cf-95df4eaf877af001f0b2.microbosh.38288 > 172.16.201.4.4222: Flags [P.], seq 650:762, ack 1115, win 1316, options [nop,nop,TS val 4294903792 ecr 4353239], length 112
01:34:04.373661 IP 172.16.201.4.4222 > 0.smoke-tests.default.cf-95df4eaf877af001f0b2.microbosh.38288: Flags [P.], seq 1115:1120, ack 762, win 678, options [nop,nop,TS val 4353240 ecr 4294903792], length 5
01:34:04.412752 IP 0.smoke-tests.default.cf-95df4eaf877af001f0b2.microbosh.38288 > 172.16.201.4.4222: Flags [.], ack 1120, win 1316, options [nop,nop,TS val 4294903802 ecr 4353240], length 0
01:34:07.025938 ARP, Request who-has 0.smoke-tests.default.cf-95df4eaf877af001f0b2.microbosh (Broadcast) tell 0.smoke-tests.default.cf-95df4eaf877af001f0b2.microbosh, length 28
































01:34:07.406199 IP 0.smoke-tests.default.cf-95df4eaf877af001f0b2.microbosh.40660 > 172.16.5.30.domain: 37391+ PTR? 2.200.16.172.in-addr.arpa. (43)
01:34:07.406850 IP 172.16.5.30.domain > 0.smoke-tests.default.cf-95df4eaf877af001f0b2.microbosh.40660: 37391 NXDomain* 0/1/0 (97)
01:34:07.502961 IP 0.smoke-tests.default.cf-95df4eaf877af001f0b2.microbosh.40151 > 172.16.5.30.domain: 43755+ A? api.cf.lab.local. (34)
01:34:07.502987 IP 0.smoke-tests.default.cf-95df4eaf877af001f0b2.microbosh.40151 > 172.16.5.30.domain: 9199+ AAAA? api.cf.lab.local. (34)
01:34:07.503626 IP 172.16.5.30.domain > 0.smoke-tests.default.cf-95df4eaf877af001f0b2.microbosh.40151: 43755* 1/1/1 A 172.16.201.5 (83)
01:34:07.503694 IP 172.16.5.30.domain > 0.smoke-tests.default.cf-95df4eaf877af001f0b2.microbosh.40151: 9199* 0/1/0 (78)
01:34:08.408302 IP 0.smoke-tests.default.cf-95df4eaf877af001f0b2.microbosh.43686 > 172.16.200.2.domain: 37888+ PTR? 30.5.16.172.in-addr.arpa. (42)
01:34:08.410637 IP 172.16.201.4.domain > 0.smoke-tests.default.cf-95df4eaf877af001f0b2.microbosh.43686: 37888 NXDomain* 0/1/0 (96)
01:34:08.410655 IP 0.smoke-tests.default.cf-95df4eaf877af001f0b2.microbosh > 172.16.201.4: ICMP 0.smoke-tests.default.cf-95df4eaf877af001f0b2.microbosh udp port 43686 unreachable, length 132
01:34:09.099828 IP 172.16.201.4.4222 > 0.smoke-tests.default.cf-95df4eaf877af001f0b2.microbosh.38288: Flags [P.], seq 1120:1126, ack 762, win 678, options [nop,nop,TS val 4354422 ecr 4294903802], length 6
01:34:09.099864 IP 0.smoke-tests.default.cf-95df4eaf877af001f0b2.microbosh.38288 > 172.16.201.4.4222: Flags [.], ack 1126, win 1316, options [nop,nop,TS val 4294904973 ecr 4354422], length 0
01:34:09.100014 IP 0.smoke-tests.default.cf-95df4eaf877af001f0b2.microbosh.38288 > 172.16.201.4.4222: Flags [P.], seq 762:768, ack 1126, win 1316, options [nop,nop,TS val 4294904973 ecr 4354422], length 6
01:34:09.138650 IP 172.16.201.4.4222 > 0.smoke-tests.default.cf-95df4eaf877af001f0b2.microbosh.38288: Flags [.], ack 768, win 678, options [nop,nop,TS val 4354432 ecr 4294904973], length 0
01:34:12.027723 ARP, Request who-has 0.smoke-tests.default.cf-95df4eaf877af001f0b2.microbosh (Broadcast) tell 0.smoke-tests.default.cf-95df4eaf877af001f0b2.microbosh, length 28
01:34:13.413492 IP 0.smoke-tests.default.cf-95df4eaf877af001f0b2.microbosh.34216 > 172.16.5.30.domain: 37888+ PTR? 30.5.16.172.in-addr.arpa. (42)
01:34:13.414218 IP 172.16.5.30.domain > 0.smoke-tests.default.cf-95df4eaf877af001f0b2.microbosh.34216: 37888 NXDomain* 0/1/0 (96)
01:34:14.101450 IP 172.16.201.4.4222 > 0.smoke-tests.default.cf-95df4eaf877af001f0b2.microbosh.38288: Flags [P.], seq 1126:1132, ack 768, win 678, options [nop,nop,TS val 4355672 ecr 4294904973], length 6
01:34:14.101615 IP 0.smoke-tests.default.cf-95df4eaf877af001f0b2.microbosh.38288 > 172.16.201.4.4222: Flags [P.], seq 768:774, ack 1132, win 1316, options [nop,nop,TS val 4294906224 ecr 4355672], length 6
01:34:14.102171 IP 172.16.201.4.4222 > 0.smoke-tests.default.cf-95df4eaf877af001f0b2.microbosh.38288: Flags [.], ack 774, win 678, options [nop,nop,TS val 4355672 ecr 4294906224], length 0
01:34:17.027289 IP 0.smoke-tests.default.cf-95df4eaf877af001f0b2.microbosh.40167 > 172.16.200.2.domain: 39987+ A? api.cf.lab.local. (34)
01:34:17.027309 IP 0.smoke-tests.default.cf-95df4eaf877af001f0b2.microbosh.40167 > 172.16.200.2.domain: 10903+ AAAA? api.cf.lab.local. (34)
01:34:17.028789 IP 172.16.201.4.domain > 0.smoke-tests.default.cf-95df4eaf877af001f0b2.microbosh.40167: 39987* 1/1/1 A 172.16.201.5 (83)
01:34:17.028806 IP 0.smoke-tests.default.cf-95df4eaf877af001f0b2.microbosh > 172.16.201.4: ICMP 0.smoke-tests.default.cf-95df4eaf877af001f0b2.microbosh udp port 40167 unreachable, length 119
01:34:17.028831 IP 172.16.201.4.domain > 0.smoke-tests.default.cf-95df4eaf877af001f0b2.microbosh.40167: 10903* 0/1/0 (78)
01:34:17.028836 IP 0.smoke-tests.default.cf-95df4eaf877af001f0b2.microbosh > 172.16.201.4: ICMP 0.smoke-tests.default.cf-95df4eaf877af001f0b2.microbosh udp port 40167 unreachable, length 114
01:34:17.029262 ARP, Request who-has 0.smoke-tests.default.cf-95df4eaf877af001f0b2.microbosh (Broadcast) tell 0.smoke-tests.default.cf-95df4eaf877af001f0b2.microbosh, length 28
01:34:19.101834 IP 172.16.201.4.4222 > 0.smoke-tests.default.cf-95df4eaf877af001f0b2.microbosh.38288: Flags [P.], seq 1132:1138, ack 774, win 678, options [nop,nop,TS val 4356922 ecr 4294906224], length 6
01:34:19.101967 IP 0.smoke-tests.default.cf-95df4eaf877af001f0b2.microbosh.38288 > 172.16.201.4.4222: Flags [P.], seq 774:780, ack 1138, win 1316, options [nop,nop,TS val 4294907474 ecr 4356922], length 6
01:34:19.102315 IP 172.16.201.4.4222 > 0.smoke-tests.default.cf-95df4eaf877af001f0b2.microbosh.38288: Flags [.], ack 780, win 678, options [nop,nop,TS val 4356923 ecr 4294907474], length 0
01:34:22.031319 ARP, Request who-has 0.smoke-tests.default.cf-95df4eaf877af001f0b2.microbosh (Broadcast) tell 0.smoke-tests.default.cf-95df4eaf877af001f0b2.microbosh, length 28
01:34:22.031364 IP 0.smoke-tests.default.cf-95df4eaf877af001f0b2.microbosh.58900 > 172.16.5.30.domain: 39987+ A? api.cf.lab.local. (34)
01:34:22.031369 IP 0.smoke-tests.default.cf-95df4eaf877af001f0b2.microbosh.58900 > 172.16.5.30.domain: 10903+ AAAA? api.cf.lab.local. (34)
01:34:22.032011 IP 172.16.5.30.domain > 0.smoke-tests.default.cf-95df4eaf877af001f0b2.microbosh.58900: 39987* 1/1/1 A 172.16.201.5 (83)
01:34:22.032076 IP 172.16.5.30.domain > 0.smoke-tests.default.cf-95df4eaf877af001f0b2.microbosh.58900: 10903* 0/1/0 (78)








01:34:24.103446 IP 172.16.201.4.4222 > 0.smoke-tests.default.cf-95df4eaf877af001f0b2.microbosh.38288: Flags [P.], seq 1138:1144, ack 780, win 678, options [nop,nop,TS val 4358173 ecr 4294907474], length 6
01:34:24.103626 IP 0.smoke-tests.default.cf-95df4eaf877af001f0b2.microbosh.38288 > 172.16.201.4.4222: Flags [P.], seq 780:786, ack 1144, win 1316, options [nop,nop,TS val 4294908724 ecr 4358173], length 6
01:34:24.104138 IP 172.16.201.4.4222 > 0.smoke-tests.default.cf-95df4eaf877af001f0b2.microbosh.38288: Flags [.], ack 786, win 678, options [nop,nop,TS val 4358173 ecr 4294908724], length 0

























01:34:27.034081 ARP, Request who-has 0.smoke-tests.default.cf-95df4eaf877af001f0b2.microbosh (Broadcast) tell 0.smoke-tests.default.cf-95df4eaf877af001f0b2.microbosh, length 28
01:34:29.083949 IP 0.smoke-tests.default.cf-95df4eaf877af001f0b2.microbosh.34884 > 172.16.200.2.domain: 3308+ A? api.cf.lab.local. (34)
01:34:29.083979 IP 0.smoke-tests.default.cf-95df4eaf877af001f0b2.microbosh.34884 > 172.16.200.2.domain: 37355+ AAAA? api.cf.lab.local. (34)
01:34:29.086328 IP 172.16.201.4.domain > 0.smoke-tests.default.cf-95df4eaf877af001f0b2.microbosh.34884: 37355* 0/1/0 (78)
01:34:29.086360 IP 0.smoke-tests.default.cf-95df4eaf877af001f0b2.microbosh > 172.16.201.4: ICMP 0.smoke-tests.default.cf-95df4eaf877af001f0b2.microbosh udp port 34884 unreachable, length 114
01:34:29.086379 IP 172.16.201.4.domain > 0.smoke-tests.default.cf-95df4eaf877af001f0b2.microbosh.34884: 3308* 1/1/1 A 172.16.201.5 (83)
01:34:29.086393 IP 0.smoke-tests.default.cf-95df4eaf877af001f0b2.microbosh > 172.16.201.4: ICMP 0.smoke-tests.default.cf-95df4eaf877af001f0b2.microbosh udp port 34884 unreachable, length 119
01:34:29.105138 IP 172.16.201.4.4222 > 0.smoke-tests.default.cf-95df4eaf877af001f0b2.microbosh.38288: Flags [P.], seq 1144:1150, ack 786, win 678, options [nop,nop,TS val 4359423 ecr 4294908724], length 6
01:34:29.105267 IP 0.smoke-tests.default.cf-95df4eaf877af001f0b2.microbosh.38288 > 172.16.201.4.4222: Flags [P.], seq 786:792, ack 1150, win 1316, options [nop,nop,TS val 4294909975 ecr 4359423], length 6
01:34:29.105800 IP 172.16.201.4.4222 > 0.smoke-tests.default.cf-95df4eaf877af001f0b2.microbosh.38288: Flags [.], ack 792, win 678, options [nop,nop,TS val 4359423 ecr 4294909975], length 0
01:34:32.035648 ARP, Request who-has 0.smoke-tests.default.cf-95df4eaf877af001f0b2.microbosh (Broadcast) tell 0.smoke-tests.default.cf-95df4eaf877af001f0b2.microbosh, length 28
01:34:34.084773 IP 0.smoke-tests.default.cf-95df4eaf877af001f0b2.microbosh.48919 > 172.16.5.30.domain: 3308+ A? api.cf.lab.local. (34)
01:34:34.084807 IP 0.smoke-tests.default.cf-95df4eaf877af001f0b2.microbosh.48919 > 172.16.5.30.domain: 37355+ AAAA? api.cf.lab.local. (34)
01:34:34.085454 IP 172.16.5.30.domain > 0.smoke-tests.default.cf-95df4eaf877af001f0b2.microbosh.48919: 3308* 1/1/1 A 172.16.201.5 (83)
01:34:34.085563 IP 172.16.5.30.domain > 0.smoke-tests.default.cf-95df4eaf877af001f0b2.microbosh.48919: 37355* 0/1/0 (78)
01:34:34.107061 IP 172.16.201.4.4222 > 0.smoke-tests.default.cf-95df4eaf877af001f0b2.microbosh.38288: Flags [P.], seq 1150:1156, ack 792, win 678, options [nop,nop,TS val 4360674 ecr 4294909975], length 6
01:34:34.107167 IP 0.smoke-tests.default.cf-95df4eaf877af001f0b2.microbosh.38288 > 172.16.201.4.4222: Flags [P.], seq 792:798, ack 1156, win 1316, options [nop,nop,TS val 4294911225 ecr 4360674], length 6
01:34:34.107798 IP 172.16.201.4.4222 > 0.smoke-tests.default.cf-95df4eaf877af001f0b2.microbosh.38288: Flags [.], ack 798, win 678, options [nop,nop,TS val 4360674 ecr 4294911225], length 0
01:34:34.375484 IP 172.16.201.4.4222 > 0.smoke-tests.default.cf-95df4eaf877af001f0b2.microbosh.38288: Flags [P.], seq 1156:1345, ack 798, win 678, options [nop,nop,TS val 4360741 ecr 4294911225], length 189
01:34:34.379798 IP 0.smoke-tests.default.cf-95df4eaf877af001f0b2.microbosh.38288 > 172.16.201.4.4222: Flags [P.], seq 798:2906, ack 1345, win 1353, options [nop,nop,TS val 4294911293 ecr 4360741], length 2108
01:34:34.380285 IP 172.16.201.4.4222 > 0.smoke-tests.default.cf-95df4eaf877af001f0b2.microbosh.38288: Flags [.], ack 2246, win 701, options [nop,nop,TS val 4360742 ecr 4294911293], length 0
01:34:34.380302 IP 172.16.201.4.4222 > 0.smoke-tests.default.cf-95df4eaf877af001f0b2.microbosh.38288: Flags [.], ack 2906, win 723, options [nop,nop,TS val 4360742 ecr 4294911293], length 0
01:34:34.380709 IP 172.16.201.4.4222 > 0.smoke-tests.default.cf-95df4eaf877af001f0b2.microbosh.38288: Flags [P.], seq 1345:1350, ack 2906, win 723, options [nop,nop,TS val 4360742 ecr 4294911293], length 5
01:34:34.384327 IP 172.16.201.4.4222 > 0.smoke-tests.default.cf-95df4eaf877af001f0b2.microbosh.38288: Flags [P.], seq 1350:1540, ack 2906, win 723, options [nop,nop,TS val 4360743 ecr 4294911293], length 190
01:34:34.384386 IP 0.smoke-tests.default.cf-95df4eaf877af001f0b2.microbosh.38288 > 172.16.201.4.4222: Flags [.], ack 1540, win 1390, options [nop,nop,TS val 4294911294 ecr 4360742], length 0
01:34:34.384724 IP 0.smoke-tests.default.cf-95df4eaf877af001f0b2.microbosh.38288 > 172.16.201.4.4222: Flags [P.], seq 2906:3083, ack 1540, win 1390, options [nop,nop,TS val 4294911295 ecr 4360742], length 177
01:34:34.385146 IP 172.16.201.4.4222 > 0.smoke-tests.default.cf-95df4eaf877af001f0b2.microbosh.38288: Flags [P.], seq 1540:1545, ack 3083, win 746, options [nop,nop,TS val 4360743 ecr 4294911295], length 5
01:34:34.386480 IP 172.16.201.4.4222 > 0.smoke-tests.default.cf-95df4eaf877af001f0b2.microbosh.38288: Flags [P.], seq 1545:1771, ack 3083, win 746, options [nop,nop,TS val 4360744 ecr 4294911295], length 226
01:34:34.386524 IP 0.smoke-tests.default.cf-95df4eaf877af001f0b2.microbosh.38288 > 172.16.201.4.4222: Flags [.], ack 1771, win 1427, options [nop,nop,TS val 4294911295 ecr 4360743], length 0
01:34:34.386849 IP 0.smoke-tests.default.cf-95df4eaf877af001f0b2.microbosh.38288 > 172.16.201.4.4222: Flags [P.], seq 3083:3260, ack 1771, win 1427, options [nop,nop,TS val 4294911295 ecr 4360743], length 177
01:34:34.387243 IP 172.16.201.4.4222 > 0.smoke-tests.default.cf-95df4eaf877af001f0b2.microbosh.38288: Flags [P.], seq 1771:1776, ack 3260, win 769, options [nop,nop,TS val 4360744 ecr 4294911295], length 5
01:34:34.424655 IP 0.smoke-tests.default.cf-95df4eaf877af001f0b2.microbosh.38288 > 172.16.201.4.4222: Flags [.], ack 1776, win 1427, options [nop,nop,TS val 4294911305 ecr 4360744], length 0
01:34:35.389030 IP 172.16.201.4.4222 > 0.smoke-tests.default.cf-95df4eaf877af001f0b2.microbosh.38288: Flags [P.], seq 1776:2002, ack 3260, win 769, options [nop,nop,TS val 4360994 ecr 4294911305], length 226
01:34:35.389064 IP 0.smoke-tests.default.cf-95df4eaf877af001f0b2.microbosh.38288 > 172.16.201.4.4222: Flags [.], ack 2002, win 1444, options [nop,nop,TS val 4294911546 ecr 4360994], length 0
01:34:35.389382 IP 0.smoke-tests.default.cf-95df4eaf877af001f0b2.microbosh.38288 > 172.16.201.4.4222: Flags [P.], seq 3260:3437, ack 2002, win 1444, options [nop,nop,TS val 4294911546 ecr 4360994], length 177
01:34:35.389850 IP 172.16.201.4.4222 > 0.smoke-tests.default.cf-95df4eaf877af001f0b2.microbosh.38288: Flags [P.], seq 2002:2007, ack 3437, win 791, options [nop,nop,TS val 4360994 ecr 4294911546], length 5
01:34:35.428649 IP 0.smoke-tests.default.cf-95df4eaf877af001f0b2.microbosh.38288 > 172.16.201.4.4222: Flags [.], ack 2007, win 1444, options [nop,nop,TS val 4294911556 ecr 4360994], length 0
01:34:36.392282 IP 172.16.201.4.4222 > 0.smoke-tests.default.cf-95df4eaf877af001f0b2.microbosh.38288: Flags [P.], seq 2007:2233, ack 3437, win 791, options [nop,nop,TS val 4361245 ecr 4294911556], length 226
01:34:36.392319 IP 0.smoke-tests.default.cf-95df4eaf877af001f0b2.microbosh.38288 > 172.16.201.4.4222: Flags [.], ack 2233, win 1444, options [nop,nop,TS val 4294911796 ecr 4361245], length 0
01:34:36.392658 IP 0.smoke-tests.default.cf-95df4eaf877af001f0b2.microbosh.38288 > 172.16.201.4.4222: Flags [P.], seq 3437:3614, ack 2233, win 1444, options [nop,nop,TS val 4294911797 ecr 4361245], length 177
01:34:36.393257 IP 172.16.201.4.4222 > 0.smoke-tests.default.cf-95df4eaf877af001f0b2.microbosh.38288: Flags [P.], seq 2233:2238, ack 3614, win 814, options [nop,nop,TS val 4361245 ecr 4294911797], length 5
01:34:36.432750 IP 0.smoke-tests.default.cf-95df4eaf877af001f0b2.microbosh.38288 > 172.16.201.4.4222: Flags [.], ack 2238, win 1444, options [nop,nop,TS val 4294911807 ecr 4361245], length 0
01:34:37.040373 ARP, Request who-has 0.smoke-tests.default.cf-95df4eaf877af001f0b2.microbosh (Broadcast) tell 0.smoke-tests.default.cf-95df4eaf877af001f0b2.microbosh, length 28
01:34:37.395925 IP 172.16.201.4.4222 > 0.smoke-tests.default.cf-95df4eaf877af001f0b2.microbosh.38288: Flags [P.], seq 2238:2464, ack 3614, win 814, options [nop,nop,TS val 4361496 ecr 4294911807], length 226
01:34:37.395950 IP 0.smoke-tests.default.cf-95df4eaf877af001f0b2.microbosh.38288 > 172.16.201.4.4222: Flags [.], ack 2464, win 1444, options [nop,nop,TS val 4294912047 ecr 4361496], length 0
01:34:37.396271 IP 0.smoke-tests.default.cf-95df4eaf877af001f0b2.microbosh.38288 > 172.16.201.4.4222: Flags [P.], seq 3614:3791, ack 2464, win 1444, options [nop,nop,TS val 4294912047 ecr 4361496], length 177
01:34:37.396858 IP 172.16.201.4.4222 > 0.smoke-tests.default.cf-95df4eaf877af001f0b2.microbosh.38288: Flags [P.], seq 2464:2469, ack 3791, win 836, options [nop,nop,TS val 4361496 ecr 4294912047], length 5
01:34:37.436659 IP 0.smoke-tests.default.cf-95df4eaf877af001f0b2.microbosh.38288 > 172.16.201.4.4222: Flags [.], ack 2469, win 1444, options [nop,nop,TS val 4294912058 ecr 4361496], length 0
01:34:38.400123 IP 172.16.201.4.4222 > 0.smoke-tests.default.cf-95df4eaf877af001f0b2.microbosh.38288: Flags [P.], seq 2469:2695, ack 3791, win 836, options [nop,nop,TS val 4361747 ecr 4294912058], length 226
01:34:38.400155 IP 0.smoke-tests.default.cf-95df4eaf877af001f0b2.microbosh.38288 > 172.16.201.4.4222: Flags [.], ack 2695, win 1444, options [nop,nop,TS val 4294912298 ecr 4361747], length 0
01:34:38.400466 IP 0.smoke-tests.default.cf-95df4eaf877af001f0b2.microbosh.38288 > 172.16.201.4.4222: Flags [P.], seq 3791:3968, ack 2695, win 1444, options [nop,nop,TS val 4294912298 ecr 4361747], length 177
01:34:38.400861 IP 172.16.201.4.4222 > 0.smoke-tests.default.cf-95df4eaf877af001f0b2.microbosh.38288: Flags [P.], seq 2695:2700, ack 3968, win 859, options [nop,nop,TS val 4361747 ecr 4294912298], length 5
01:34:38.440659 IP 0.smoke-tests.default.cf-95df4eaf877af001f0b2.microbosh.38288 > 172.16.201.4.4222: Flags [.], ack 2700, win 1444, options [nop,nop,TS val 4294912309 ecr 4361747], length 0
01:34:38.623740 IP 0.smoke-tests.default.cf-95df4eaf877af001f0b2.microbosh.35874 > 172.16.200.2.domain: 35549+ A? api.cf.lab.local. (34)
01:34:38.624152 IP 172.16.200.2.domain > 0.smoke-tests.default.cf-95df4eaf877af001f0b2.microbosh.35874: 35549* 1/1/1 A 172.16.201.5 (83)
01:34:38.624657 IP 0.smoke-tests.default.cf-95df4eaf877af001f0b2.microbosh.35874 > 172.16.200.2.domain: 26319+ AAAA? api.cf.lab.local. (34)
01:34:38.624952 IP 172.16.200.2.domain > 0.smoke-tests.default.cf-95df4eaf877af001f0b2.microbosh.35874: 26319* 0/1/0 (78)
01:34:38.625042 ARP, Request who-has 0.ha-proxy-partition-59c4a0eba93e688cb746.default.cf-95df4eaf877af001f0b2.microbosh tell 0.smoke-tests.default.cf-95df4eaf877af001f0b2.microbosh, length 28
01:34:38.625262 ARP, Reply 0.ha-proxy-partition-59c4a0eba93e688cb746.default.cf-95df4eaf877af001f0b2.microbosh is-at 00:50:56:81:eb:b8 (oui Unknown), length 46
01:34:38.625277 IP 0.smoke-tests.default.cf-95df4eaf877af001f0b2.microbosh.46204 > 0.ha-proxy-partition-59c4a0eba93e688cb746.default.cf-95df4eaf877af001f0b2.microbosh.https: Flags [S], seq 1834427385, win 29200, options [mss 1460,sackOK,TS val 4294912355 ecr 0,nop,wscale 7], length 0
01:34:38.625384 IP 0.ha-proxy-partition-59c4a0eba93e688cb746.default.cf-95df4eaf877af001f0b2.microbosh.https > 0.smoke-tests.default.cf-95df4eaf877af001f0b2.microbosh.46204: Flags [S.], seq 2034138865, ack 1834427386, win 28960, options [mss 1460,sackOK,TS val 3206296 ecr 4294912355,nop,wscale 7], length 0
01:34:38.625402 IP 0.smoke-tests.default.cf-95df4eaf877af001f0b2.microbosh.46204 > 0.ha-proxy-partition-59c4a0eba93e688cb746.default.cf-95df4eaf877af001f0b2.microbosh.https: Flags [.], ack 1, win 229, options [nop,nop,TS val 4294912355 ecr 3206296], length 0
01:34:38.625763 IP 0.smoke-tests.default.cf-95df4eaf877af001f0b2.microbosh.46204 > 0.ha-proxy-partition-59c4a0eba93e688cb746.default.cf-95df4eaf877af001f0b2.microbosh.https: Flags [P.], seq 1:143, ack 1, win 229, options [nop,nop,TS val 4294912355 ecr 3206296], length 142
01:34:38.628195 IP 0.ha-proxy-partition-59c4a0eba93e688cb746.default.cf-95df4eaf877af001f0b2.microbosh.https > 0.smoke-tests.default.cf-95df4eaf877af001f0b2.microbosh.46204: Flags [P.], seq 1:1256, ack 143, win 235, options [nop,nop,TS val 3206297 ecr 4294912355], length 1255
01:34:38.628215 IP 0.smoke-tests.default.cf-95df4eaf877af001f0b2.microbosh.46204 > 0.ha-proxy-partition-59c4a0eba93e688cb746.default.cf-95df4eaf877af001f0b2.microbosh.https: Flags [.], ack 1256, win 251, options [nop,nop,TS val 4294912355 ecr 3206297], length 0
01:34:38.631162 IP 0.smoke-tests.default.cf-95df4eaf877af001f0b2.microbosh.46204 > 0.ha-proxy-partition-59c4a0eba93e688cb746.default.cf-95df4eaf877af001f0b2.microbosh.https: Flags [P.], seq 143:218, ack 1256, win 251, options [nop,nop,TS val 4294912356 ecr 3206297], length 75
01:34:38.632558 IP 0.smoke-tests.default.cf-95df4eaf877af001f0b2.microbosh.46204 > 0.ha-proxy-partition-59c4a0eba93e688cb746.default.cf-95df4eaf877af001f0b2.microbosh.https: Flags [P.], seq 218:224, ack 1256, win 251, options [nop,nop,TS val 4294912356 ecr 3206297], length 6
01:34:38.632615 IP 0.smoke-tests.default.cf-95df4eaf877af001f0b2.microbosh.46204 > 0.ha-proxy-partition-59c4a0eba93e688cb746.default.cf-95df4eaf877af001f0b2.microbosh.https: Flags [P.], seq 224:269, ack 1256, win 251, options [nop,nop,TS val 4294912356 ecr 3206297], length 45
01:34:38.632759 IP 0.ha-proxy-partition-59c4a0eba93e688cb746.default.cf-95df4eaf877af001f0b2.microbosh.https > 0.smoke-tests.default.cf-95df4eaf877af001f0b2.microbosh.46204: Flags [.], ack 269, win 235, options [nop,nop,TS val 3206298 ecr 4294912356], length 0
01:34:38.632814 IP 0.ha-proxy-partition-59c4a0eba93e688cb746.default.cf-95df4eaf877af001f0b2.microbosh.https > 0.smoke-tests.default.cf-95df4eaf877af001f0b2.microbosh.46204: Flags [P.], seq 1256:1307, ack 269, win 235, options [nop,nop,TS val 3206298 ecr 4294912356], length 51
01:34:38.632921 IP 0.smoke-tests.default.cf-95df4eaf877af001f0b2.microbosh.46204 > 0.ha-proxy-partition-59c4a0eba93e688cb746.default.cf-95df4eaf877af001f0b2.microbosh.https: Flags [P.], seq 269:470, ack 1307, win 251, options [nop,nop,TS val 4294912357 ecr 3206298], length 201
01:34:38.640290 IP 0.ha-proxy-partition-59c4a0eba93e688cb746.default.cf-95df4eaf877af001f0b2.microbosh.https > 0.smoke-tests.default.cf-95df4eaf877af001f0b2.microbosh.46204: Flags [P.], seq 1307:1994, ack 470, win 243, options [nop,nop,TS val 3206300 ecr 4294912357], length 687
01:34:38.654185 IP 0.smoke-tests.default.cf-95df4eaf877af001f0b2.microbosh.46204 > 0.ha-proxy-partition-59c4a0eba93e688cb746.default.cf-95df4eaf877af001f0b2.microbosh.https: Flags [F.], seq 470, ack 1994, win 271, options [nop,nop,TS val 4294912362 ecr 3206300], length 0
01:34:38.654412 IP 0.ha-proxy-partition-59c4a0eba93e688cb746.default.cf-95df4eaf877af001f0b2.microbosh.https > 0.smoke-tests.default.cf-95df4eaf877af001f0b2.microbosh.46204: Flags [P.], seq 1994:2025, ack 471, win 243, options [nop,nop,TS val 3206304 ecr 4294912362], length 31
01:34:38.654438 IP 0.smoke-tests.default.cf-95df4eaf877af001f0b2.microbosh.46204 > 0.ha-proxy-partition-59c4a0eba93e688cb746.default.cf-95df4eaf877af001f0b2.microbosh.https: Flags [R], seq 1834427856, win 0, length 0
01:34:38.654448 IP 0.ha-proxy-partition-59c4a0eba93e688cb746.default.cf-95df4eaf877af001f0b2.microbosh.https > 0.smoke-tests.default.cf-95df4eaf877af001f0b2.microbosh.46204: Flags [F.], seq 2025, ack 471, win 243, options [nop,nop,TS val 3206304 ecr 4294912362], length 0
01:34:38.654453 IP 0.smoke-tests.default.cf-95df4eaf877af001f0b2.microbosh.46204 > 0.ha-proxy-partition-59c4a0eba93e688cb746.default.cf-95df4eaf877af001f0b2.microbosh.https: Flags [R], seq 1834427856, win 0, length 0
01:34:39.108074 IP 172.16.201.4.4222 > 0.smoke-tests.default.cf-95df4eaf877af001f0b2.microbosh.38288: Flags [P.], seq 2700:2706, ack 3968, win 859, options [nop,nop,TS val 4361924 ecr 4294912309], length 6
01:34:39.108102 IP 0.smoke-tests.default.cf-95df4eaf877af001f0b2.microbosh.38288 > 172.16.201.4.4222: Flags [.], ack 2706, win 1444, options [nop,nop,TS val 4294912475 ecr 4361924], length 0
01:34:39.108198 IP 0.smoke-tests.default.cf-95df4eaf877af001f0b2.microbosh.38288 > 172.16.201.4.4222: Flags [P.], seq 3968:3974, ack 2706, win 1444, options [nop,nop,TS val 4294912475 ecr 4361924], length 6
01:34:39.146458 IP 172.16.201.4.4222 > 0.smoke-tests.default.cf-95df4eaf877af001f0b2.microbosh.38288: Flags [.], ack 3974, win 859, options [nop,nop,TS val 4361934 ecr 4294912475], length 0
01:34:39.402136 IP 0.smoke-tests.default.cf-95df4eaf877af001f0b2.microbosh.45467 > 172.16.200.2.domain: 21181+ PTR? 5.201.16.172.in-addr.arpa. (43)
01:34:39.404980 IP 172.16.200.2.domain > 0.smoke-tests.default.cf-95df4eaf877af001f0b2.microbosh.45467: 21181* 1/0/0 PTR 0.ha-proxy-partition-59c4a0eba93e688cb746.default.cf-95df4eaf877af001f0b2.microbosh. (140)
01:34:39.418694 IP 172.16.201.4.4222 > 0.smoke-tests.default.cf-95df4eaf877af001f0b2.microbosh.38288: Flags [P.], seq 2706:2932, ack 3974, win 859, options [nop,nop,TS val 4362002 ecr 4294912475], length 226
01:34:39.419028 IP 0.smoke-tests.default.cf-95df4eaf877af001f0b2.microbosh.38288 > 172.16.201.4.4222: Flags [P.], seq 3974:4151, ack 2932, win 1444, options [nop,nop,TS val 4294912553 ecr 4362002], length 177
01:34:39.419357 IP 172.16.201.4.4222 > 0.smoke-tests.default.cf-95df4eaf877af001f0b2.microbosh.38288: Flags [.], ack 4151, win 882, options [nop,nop,TS val 4362002 ecr 4294912553], length 0
01:34:39.419588 IP 172.16.201.4.4222 > 0.smoke-tests.default.cf-95df4eaf877af001f0b2.microbosh.38288: Flags [P.], seq 2932:2937, ack 4151, win 882, options [nop,nop,TS val 4362002 ecr 4294912553], length 5
01:34:39.456660 IP 0.smoke-tests.default.cf-95df4eaf877af001f0b2.microbosh.38288 > 172.16.201.4.4222: Flags [.], ack 2937, win 1444, options [nop,nop,TS val 4294912563 ecr 4362002], length 0
01:34:40.421539 IP 172.16.201.4.4222 > 0.smoke-tests.default.cf-95df4eaf877af001f0b2.microbosh.38288: Flags [P.], seq 2937:3163, ack 4151, win 882, options [nop,nop,TS val 4362252 ecr 4294912563], length 226
01:34:40.421560 IP 0.smoke-tests.default.cf-95df4eaf877af001f0b2.microbosh.38288 > 172.16.201.4.4222: Flags [.], ack 3163, win 1444, options [nop,nop,TS val 4294912804 ecr 4362252], length 0
01:34:40.421857 IP 0.smoke-tests.default.cf-95df4eaf877af001f0b2.microbosh.38288 > 172.16.201.4.4222: Flags [P.], seq 4151:4328, ack 3163, win 1444, options [nop,nop,TS val 4294912804 ecr 4362252], length 177
01:34:40.422372 IP 172.16.201.4.4222 > 0.smoke-tests.default.cf-95df4eaf877af001f0b2.microbosh.38288: Flags [P.], seq 3163:3168, ack 4328, win 904, options [nop,nop,TS val 4362253 ecr 4294912804], length 5
01:34:40.460663 IP 0.smoke-tests.default.cf-95df4eaf877af001f0b2.microbosh.38288 > 172.16.201.4.4222: Flags [.], ack 3168, win 1444, options [nop,nop,TS val 4294912814 ecr 4362253], length 0
01:34:41.424251 IP 172.16.201.4.4222 > 0.smoke-tests.default.cf-95df4eaf877af001f0b2.microbosh.38288: Flags [P.], seq 3168:3394, ack 4328, win 904, options [nop,nop,TS val 4362503 ecr 4294912814], length 226
01:34:41.424278 IP 0.smoke-tests.default.cf-95df4eaf877af001f0b2.microbosh.38288 > 172.16.201.4.4222: Flags [.], ack 3394, win 1444, options [nop,nop,TS val 4294913054 ecr 4362503], length 0
01:34:41.424586 IP 0.smoke-tests.default.cf-95df4eaf877af001f0b2.microbosh.38288 > 172.16.201.4.4222: Flags [P.], seq 4328:4505, ack 3394, win 1444, options [nop,nop,TS val 4294913054 ecr 4362503], length 177
01:34:41.425066 IP 172.16.201.4.4222 > 0.smoke-tests.default.cf-95df4eaf877af001f0b2.microbosh.38288: Flags [P.], seq 3394:3399, ack 4505, win 927, options [nop,nop,TS val 4362503 ecr 4294913054], length 5
01:34:41.464652 IP 0.smoke-tests.default.cf-95df4eaf877af001f0b2.microbosh.38288 > 172.16.201.4.4222: Flags [.], ack 3399, win 1444, options [nop,nop,TS val 4294913065 ecr 4362503], length 0
01:34:42.045008 ARP, Request who-has 0.smoke-tests.default.cf-95df4eaf877af001f0b2.microbosh (Broadcast) tell 0.smoke-tests.default.cf-95df4eaf877af001f0b2.microbosh, length 28
01:34:42.427601 IP 172.16.201.4.4222 > 0.smoke-tests.default.cf-95df4eaf877af001f0b2.microbosh.38288: Flags [P.], seq 3399:3625, ack 4505, win 927, options [nop,nop,TS val 4362754 ecr 4294913065], length 226
01:34:42.427629 IP 0.smoke-tests.default.cf-95df4eaf877af001f0b2.microbosh.38288 > 172.16.201.4.4222: Flags [.], ack 3625, win 1444, options [nop,nop,TS val 4294913305 ecr 4362754], length 0
01:34:42.427958 IP 0.smoke-tests.default.cf-95df4eaf877af001f0b2.microbosh.38288 > 172.16.201.4.4222: Flags [P.], seq 4505:4682, ack 3625, win 1444, options [nop,nop,TS val 4294913305 ecr 4362754], length 177
01:34:42.428501 IP 172.16.201.4.4222 > 0.smoke-tests.default.cf-95df4eaf877af001f0b2.microbosh.38288: Flags [P.], seq 3625:3630, ack 4682, win 950, options [nop,nop,TS val 4362754 ecr 4294913305], length 5
01:34:42.464662 IP 0.smoke-tests.default.cf-95df4eaf877af001f0b2.microbosh.38288 > 172.16.201.4.4222: Flags [.], ack 3630, win 1444, options [nop,nop,TS val 4294913315 ecr 4362754], length 0
01:34:43.431953 IP 172.16.201.4.4222 > 0.smoke-tests.default.cf-95df4eaf877af001f0b2.microbosh.38288: Flags [P.], seq 3630:3856, ack 4682, win 950, options [nop,nop,TS val 4363005 ecr 4294913315], length 226
01:34:43.431976 IP 0.smoke-tests.default.cf-95df4eaf877af001f0b2.microbosh.38288 > 172.16.201.4.4222: Flags [.], ack 3856, win 1444, options [nop,nop,TS val 4294913556 ecr 4363005], length 0
01:34:43.432263 IP 0.smoke-tests.default.cf-95df4eaf877af001f0b2.microbosh.38288 > 172.16.201.4.4222: Flags [P.], seq 4682:4859, ack 3856, win 1444, options [nop,nop,TS val 4294913556 ecr 4363005], length 177
01:34:43.432739 IP 172.16.201.4.4222 > 0.smoke-tests.default.cf-95df4eaf877af001f0b2.microbosh.38288: Flags [P.], seq 3856:3861, ack 4859, win 972, options [nop,nop,TS val 4363005 ecr 4294913556], length 5
01:34:43.472668 IP 0.smoke-tests.default.cf-95df4eaf877af001f0b2.microbosh.38288 > 172.16.201.4.4222: Flags [.], ack 3861, win 1444, options [nop,nop,TS val 4294913567 ecr 4363005], length 0
01:34:44.108716 IP 172.16.201.4.4222 > 0.smoke-tests.default.cf-95df4eaf877af001f0b2.microbosh.38288: Flags [P.], seq 3861:3867, ack 4859, win 972, options [nop,nop,TS val 4363174 ecr 4294913567], length 6
01:34:44.108746 IP 0.smoke-tests.default.cf-95df4eaf877af001f0b2.microbosh.38288 > 172.16.201.4.4222: Flags [.], ack 3867, win 1444, options [nop,nop,TS val 4294913726 ecr 4363174], length 0
01:34:44.108812 IP 0.smoke-tests.default.cf-95df4eaf877af001f0b2.microbosh.38288 > 172.16.201.4.4222: Flags [P.], seq 4859:4865, ack 3867, win 1444, options [nop,nop,TS val 4294913726 ecr 4363174], length 6
01:34:44.146394 IP 172.16.201.4.4222 > 0.smoke-tests.default.cf-95df4eaf877af001f0b2.microbosh.38288: Flags [.], ack 4865, win 972, options [nop,nop,TS val 4363184 ecr 4294913726], length 0
01:34:44.436458 IP 172.16.201.4.4222 > 0.smoke-tests.default.cf-95df4eaf877af001f0b2.microbosh.38288: Flags [P.], seq 3867:4093, ack 4865, win 972, options [nop,nop,TS val 4363256 ecr 4294913726], length 226
01:34:44.436808 IP 0.smoke-tests.default.cf-95df4eaf877af001f0b2.microbosh.38288 > 172.16.201.4.4222: Flags [P.], seq 4865:5042, ack 4093, win 1444, options [nop,nop,TS val 4294913808 ecr 4363256], length 177
01:34:44.437251 IP 172.16.201.4.4222 > 0.smoke-tests.default.cf-95df4eaf877af001f0b2.microbosh.38288: Flags [.], ack 5042, win 995, options [nop,nop,TS val 4363256 ecr 4294913808], length 0
01:34:44.437432 IP 172.16.201.4.4222 > 0.smoke-tests.default.cf-95df4eaf877af001f0b2.microbosh.38288: Flags [P.], seq 4093:4098, ack 5042, win 995, options [nop,nop,TS val 4363256 ecr 4294913808], length 5
01:34:44.476665 IP 0.smoke-tests.default.cf-95df4eaf877af001f0b2.microbosh.38288 > 172.16.201.4.4222: Flags [.], ack 4098, win 1444, options [nop,nop,TS val 4294913818 ecr 4363256], length 0
01:34:45.090753 IP 0.smoke-tests.default.cf-95df4eaf877af001f0b2.microbosh.38288 > 172.16.201.4.4222: Flags [P.], seq 5042:5425, ack 4098, win 1444, options [nop,nop,TS val 4294913971 ecr 4363256], length 383
01:34:45.091457 IP 172.16.201.4.4222 > 0.smoke-tests.default.cf-95df4eaf877af001f0b2.microbosh.38288: Flags [P.], seq 4098:4103, ack 5425, win 1017, options [nop,nop,TS val 4363420 ecr 4294913971], length 5
01:34:45.091467 IP 0.smoke-tests.default.cf-95df4eaf877af001f0b2.microbosh.38288 > 172.16.201.4.4222: Flags [.], ack 4103, win 1444, options [nop,nop,TS val 4294913971 ecr 4363420], length 0
01:34:45.440088 IP 172.16.201.4.4222 > 0.smoke-tests.default.cf-95df4eaf877af001f0b2.microbosh.38288: Flags [P.], seq 4103:4329, ack 5425, win 1017, options [nop,nop,TS val 4363507 ecr 4294913971], length 226
01:34:45.440115 IP 0.smoke-tests.default.cf-95df4eaf877af001f0b2.microbosh.38288 > 172.16.201.4.4222: Flags [.], ack 4329, win 1444, options [nop,nop,TS val 4294914058 ecr 4363507], length 0
01:34:45.440453 IP 0.smoke-tests.default.cf-95df4eaf877af001f0b2.microbosh.38288 > 172.16.201.4.4222: Flags [P.], seq 5425:5602, ack 4329, win 1444, options [nop,nop,TS val 4294914058 ecr 4363507], length 177
01:34:45.441133 IP 172.16.201.4.4222 > 0.smoke-tests.default.cf-95df4eaf877af001f0b2.microbosh.38288: Flags [P.], seq 4329:4334, ack 5602, win 1040, options [nop,nop,TS val 4363507 ecr 4294914058], length 5
01:34:45.480670 IP 0.smoke-tests.default.cf-95df4eaf877af001f0b2.microbosh.38288 > 172.16.201.4.4222: Flags [.], ack 4334, win 1444, options [nop,nop,TS val 4294914069 ecr 4363507], length 0
01:34:46.443050 IP 172.16.201.4.4222 > 0.smoke-tests.default.cf-95df4eaf877af001f0b2.microbosh.38288: Flags [P.], seq 4334:4560, ack 5602, win 1040, options [nop,nop,TS val 4363758 ecr 4294914069], length 226
01:34:46.443076 IP 0.smoke-tests.default.cf-95df4eaf877af001f0b2.microbosh.38288 > 172.16.201.4.4222: Flags [.], ack 4560, win 1444, options [nop,nop,TS val 4294914309 ecr 4363758], length 0
01:34:46.443405 IP 0.smoke-tests.default.cf-95df4eaf877af001f0b2.microbosh.38288 > 172.16.201.4.4222: Flags [P.], seq 5602:5779, ack 4560, win 1444, options [nop,nop,TS val 4294914309 ecr 4363758], length 177
01:34:46.443704 IP 172.16.201.4.4222 > 0.smoke-tests.default.cf-95df4eaf877af001f0b2.microbosh.38288: Flags [P.], seq 4560:4565, ack 5779, win 1063, options [nop,nop,TS val 4363758 ecr 4294914309], length 5
01:34:46.480660 IP 0.smoke-tests.default.cf-95df4eaf877af001f0b2.microbosh.38288 > 172.16.201.4.4222: Flags [.], ack 4565, win 1444, options [nop,nop,TS val 4294914319 ecr 4363758], length 0
01:34:47.049225 ARP, Request who-has 0.smoke-tests.default.cf-95df4eaf877af001f0b2.microbosh (Broadcast) tell 0.smoke-tests.default.cf-95df4eaf877af001f0b2.microbosh, length 28
01:34:47.446378 IP 172.16.201.4.4222 > 0.smoke-tests.default.cf-95df4eaf877af001f0b2.microbosh.38288: Flags [P.], seq 4565:4791, ack 5779, win 1063, options [nop,nop,TS val 4364009 ecr 4294914319], length 226
01:34:47.446406 IP 0.smoke-tests.default.cf-95df4eaf877af001f0b2.microbosh.38288 > 172.16.201.4.4222: Flags [.], ack 4791, win 1444, options [nop,nop,TS val 4294914560 ecr 4364009], length 0
01:34:47.446742 IP 0.smoke-tests.default.cf-95df4eaf877af001f0b2.microbosh.38288 > 172.16.201.4.4222: Flags [P.], seq 5779:5956, ack 4791, win 1444, options [nop,nop,TS val 4294914560 ecr 4364009], length 177
01:34:47.447208 IP 172.16.201.4.4222 > 0.smoke-tests.default.cf-95df4eaf877af001f0b2.microbosh.38288: Flags [P.], seq 4791:4796, ack 5956, win 1085, options [nop,nop,TS val 4364009 ecr 4294914560], length 5
01:34:47.484662 IP 0.smoke-tests.default.cf-95df4eaf877af001f0b2.microbosh.38288 > 172.16.201.4.4222: Flags [.], ack 4796, win 1444, options [nop,nop,TS val 4294914570 ecr 4364009], length 0
01:34:48.450062 IP 172.16.201.4.4222 > 0.smoke-tests.default.cf-95df4eaf877af001f0b2.microbosh.38288: Flags [P.], seq 4796:5022, ack 5956, win 1085, options [nop,nop,TS val 4364259 ecr 4294914570], length 226
01:34:48.450092 IP 0.smoke-tests.default.cf-95df4eaf877af001f0b2.microbosh.38288 > 172.16.201.4.4222: Flags [.], ack 5022, win 1444, options [nop,nop,TS val 4294914811 ecr 4364259], length 0
01:34:48.450387 IP 0.smoke-tests.default.cf-95df4eaf877af001f0b2.microbosh.38288 > 172.16.201.4.4222: Flags [P.], seq 5956:6133, ack 5022, win 1444, options [nop,nop,TS val 4294914811 ecr 4364259], length 177
01:34:48.450921 IP 172.16.201.4.4222 > 0.smoke-tests.default.cf-95df4eaf877af001f0b2.microbosh.38288: Flags [P.], seq 5022:5027, ack 6133, win 1108, options [nop,nop,TS val 4364260 ecr 4294914811], length 5
01:34:48.488674 IP 0.smoke-tests.default.cf-95df4eaf877af001f0b2.microbosh.38288 > 172.16.201.4.4222: Flags [.], ack 5027, win 1444, options [nop,nop,TS val 4294914821 ecr 4364260], length 0
01:34:49.109378 IP 172.16.201.4.4222 > 0.smoke-tests.default.cf-95df4eaf877af001f0b2.microbosh.38288: Flags [P.], seq 5027:5033, ack 6133, win 1108, options [nop,nop,TS val 4364424 ecr 4294914821], length 6
01:34:49.109403 IP 0.smoke-tests.default.cf-95df4eaf877af001f0b2.microbosh.38288 > 172.16.201.4.4222: Flags [.], ack 5033, win 1444, options [nop,nop,TS val 4294914976 ecr 4364424], length 0
01:34:49.109483 IP 0.smoke-tests.default.cf-95df4eaf877af001f0b2.microbosh.38288 > 172.16.201.4.4222: Flags [P.], seq 6133:6139, ack 5033, win 1444, options [nop,nop,TS val 4294914976 ecr 4364424], length 6
01:34:49.146326 IP 172.16.201.4.4222 > 0.smoke-tests.default.cf-95df4eaf877af001f0b2.microbosh.38288: Flags [.], ack 6139, win 1108, options [nop,nop,TS val 4364434 ecr 4294914976], length 0
01:34:49.453909 IP 172.16.201.4.4222 > 0.smoke-tests.default.cf-95df4eaf877af001f0b2.microbosh.38288: Flags [P.], seq 5033:5259, ack 6139, win 1108, options [nop,nop,TS val 4364510 ecr 4294914976], length 226
01:34:49.454224 IP 0.smoke-tests.default.cf-95df4eaf877af001f0b2.microbosh.38288 > 172.16.201.4.4222: Flags [P.], seq 6139:6316, ack 5259, win 1444, options [nop,nop,TS val 4294915062 ecr 4364510], length 177
01:34:49.454458 IP 172.16.201.4.4222 > 0.smoke-tests.default.cf-95df4eaf877af001f0b2.microbosh.38288: Flags [.], ack 6316, win 1131, options [nop,nop,TS val 4364511 ecr 4294915062], length 0
01:34:49.454671 IP 172.16.201.4.4222 > 0.smoke-tests.default.cf-95df4eaf877af001f0b2.microbosh.38288: Flags [P.], seq 5259:5264, ack 6316, win 1131, options [nop,nop,TS val 4364511 ecr 4294915062], length 5
01:34:49.492680 IP 0.smoke-tests.default.cf-95df4eaf877af001f0b2.microbosh.38288 > 172.16.201.4.4222: Flags [.], ack 5264, win 1444, options [nop,nop,TS val 4294915072 ecr 4364511], length 0
01:34:50.137187 IP 0.smoke-tests.default.cf-95df4eaf877af001f0b2.microbosh.56109 > 172.16.200.2.domain: 41928+ A? api.cf.lab.local. (34)
01:34:50.137228 IP 0.smoke-tests.default.cf-95df4eaf877af001f0b2.microbosh.56109 > 172.16.200.2.domain: 15529+ AAAA? api.cf.lab.local. (34)
01:34:50.137666 IP 172.16.200.2.domain > 0.smoke-tests.default.cf-95df4eaf877af001f0b2.microbosh.56109: 41928* 1/1/1 A 172.16.201.5 (83)
01:34:50.138346 IP 172.16.201.4.domain > 0.smoke-tests.default.cf-95df4eaf877af001f0b2.microbosh.56109: 15529* 0/1/0 (78)
01:34:50.138361 IP 0.smoke-tests.default.cf-95df4eaf877af001f0b2.microbosh > 172.16.201.4: ICMP 0.smoke-tests.default.cf-95df4eaf877af001f0b2.microbosh udp port 56109 unreachable, length 114
^C
236 packets captured
241 packets received by filter
0 packets dropped by kernel

**Comment by bfeeny** [comment]
I believe I have figured out the cause of the problem, but not how to fix it.

When I log into my smoke-tests VM, here is what the /etc/resolv.conf looks like:

cap@497b8af0-dc12-49e4-a702-ad59c6348d59:~$ cat /etc/resolv.conf 
nameserver 172.16.200.2
nameserver 172.16.5.30
nameserver 172.16.201.4

172.16.200.2 is the Infrastructure Network address for Ops Manager Director
172.16.5.30 is my internal DNS server, the one I configured whenever asked for DNS
172.16.201.4 is the Deployment Network address for Ops Manager Director

Obviously the host will attempt to use the first address listed in /etc/resolv.conf to 
resolve names.  Below I test resolving against all three hosts listed in resolv.conf:

vcap@497b8af0-dc12-49e4-a702-ad59c6348d59:~$ nslookup api.cf.lab.local 172.16.200.2
;; reply from unexpected source: 172.16.201.4#53, expected 172.16.200.2#53
Server:		172.16.200.2
Address:	172.16.200.2#53

Name:	api.cf.lab.local
Address: 172.16.201.5

vcap@497b8af0-dc12-49e4-a702-ad59c6348d59:~$ nslookup api.cf.lab.local 172.16.5.30
Server:		172.16.5.30
Address:	172.16.5.30#53

Name:	api.cf.lab.local
Address: 172.16.201.5

vcap@497b8af0-dc12-49e4-a702-ad59c6348d59:~$ nslookup api.cf.lab.local 172.16.201.4
Server:		172.16.201.4
Address:	172.16.201.4#53

Name:	api.cf.lab.local
Address: 172.16.201.5

When attempting to resolve against 172.16.200.2, you see it outputs "reply from unexpected source".
There is also a considerable delay.  Resolutions against the other sources are instantaneous,
with no delay or any strange output.

I test again against 172.16.200.2 for good measure:

vcap@497b8af0-dc12-49e4-a702-ad59c6348d59:~$ nslookup api.cf.lab.local 172.16.200.2
;; reply from unexpected source: 172.16.201.4#53, expected 172.16.200.2#53
Server:		172.16.200.2
Address:	172.16.200.2#53

Name:	api.cf.lab.local
Address: 172.16.201.5

We can see the routing table on the Ops Manager Director below:

vcap@bm-f80e2644-c1d2-4c30-af89-4885bacf1a98:~$ netstat -rn
Kernel IP routing table
Destination     Gateway         Genmask         Flags   MSS Window  irtt Iface
0.0.0.0         172.16.200.1    0.0.0.0         UG        0 0          0 eth0
172.16.200.0    0.0.0.0         255.255.255.0   U         0 0          0 eth0
172.16.201.0    0.0.0.0         255.255.255.0   U         0 0          0 eth1

It is dual homed on both the Deployment and Infrastructure networks as expected.
It's default gateway is on the Infrastructure network.  The Ops Mgr should be able
to communicate on either network, using either address.  Obviously if the Ops Mgr
were to receive traffic from a network not local to it, it would need to respond 
using its Infrastructure address 172.16.200.2.

Its like the Ops Mgr is trying to be efficient.  It see's a packet coming to it from
the smoke-test VM at 172.16.201.24, and destined to its 172.16.200.2 address.  The Ops
Mgr responds from its 172.16.201.4 address as its local to the requester.  But this does
not seem correct, as the requester is not prepared to see a reply from a different 
address than it requested.  So I have a few questions:

1. Should Ops Mgr have its default gateway on the Infrastructure network as its shown?
If not, how should I change this?

2. Should both Ops Manager addresses be listed in /etc/resolv.conf on the smoke-tests VM?
If so, then I believe Ops Mgr should be responding differently, and not using a different
address than how it was contacted.

A "fix" I would think is to not have Ops Mgr's Infrastructure address listed in 
/etc/resolv.conf.  Not really sure what benefit it brings by having it there.

Any help in how this should be resolved is greatly appreciated.

**Comment by bfeeny** [comment]
It turns out this is a bug.  Fixed in PCF 1.4.  Here is the reply from my open ticket with Pivotal support:

Brian

Thanks for clarifying this.

I have confirmed an issue with Pivotal CF <= v1.3.4.0, the Ops Manager Director IP is placed prior to DNS servers configured at "Create Network". If infrastructure and deployment are separated networks, Cloud Foundry VMs may fail to resolve host address at the first try.

This problem has been fixed at Pivotal CF v1.4 release, Ops Manager Director IP is placed at the end of /etc/resolv.conf instead of the beginning.

$ cat /etc/resolv.conf
nameserver 8.8.8.8
nameserver 8.8.4.4
nameserver <ops manager director IP>
To change this behaviour in Pivotal CF v1.3.x, on the Ops Manager VM, change /home/tempest-web/tempest/app/models/tempest/manifests/network_section.rb

Line 20: "dns" => [microbosh_dns_ip] + network.parsed_dns,

to "dns" => network.parsed_dns,

Restart the tempest-web service and then hit re-apply. Please let me know if you want a live session to discuss this or need any help to re-deploy PCF.

Thanks & Regards,

Tao Deng
Pivotal Support
