### ISSUE TITLE
cf-cli api is not working on WSL bash on windows 10

### ISSUE THREAD

**Issue by SebBlin** [cloudfoundry/cli#1319]
Hello, 
I'm working with windows 10 and the integrated bash (WSL)
when executing the command
`cf api https://api.ng.bluemix.net -v`

I get the message:
```
seb@my-machine:~$ cf api https://api.ng.bluemix.net -v
Setting api endpoint to https://api.ng.bluemix.net...
REQUEST: [2018-02-01T15:17:05+01:00]
GET /v2/info HTTP/1.1
Host: api.ng.bluemix.net
Accept: application/json
User-Agent: cf/6.34.1+bbdf81482.2018-01-17 (go1.9.2; amd64 linux)

REQUEST: [2018-02-01T15:17:10+01:00]
GET /v2/info HTTP/1.1
Host: api.ng.bluemix.net
Accept: application/json
User-Agent: cf/6.34.1+bbdf81482.2018-01-17 (go1.9.2; amd64 linux)

REQUEST: [2018-02-01T15:17:15+01:00]
GET /v2/info HTTP/1.1
Host: api.ng.bluemix.net
Accept: application/json
User-Agent: cf/6.34.1+bbdf81482.2018-01-17 (go1.9.2; amd64 linux)

Request error: Get https://api.ng.bluemix.net/v2/info: dial tcp: i/o timeout
TIP: If you are behind a firewall and require an HTTP proxy, verify the https_proxy environment variable is correctly set. Else, check your network connection.
FAILED
```

I'm not using any proxy.

my CLI Version  is 
`cf version 6.34.1+bbdf81482.2018-01-17`

if I try to execute 
`wget https://api.ng.bluemix.net/v2/info`
it works fine. 
if I try the the same commande `cf api https://api.ng.bluemix.net -v` directly from windows command, it works fine also (my windows version is older cf version 6.32.0+0191c33d9.2017-09-26).   

Any idea? 

regards 
Sébastien

**Comment by XenoPhex** [comment]
Hey there @SebBlin,

At the moment the CF CLI does not support WSL on Windows. There also appears to be limited golang support for WSL. We will keep the issue open until golang adds better support. For now, we only support the standard command prompt and Powershell on Windows.

**Comment by XenoPhex** [comment]
Hi @SebBlin thanks for creating this issue. We are closing this issue because if Golang does not support WSL on Windows, then we have no plans to do so either. 

Note: This is similar to issue #171.

**Comment by cunnie** [comment]
This can also happen if you have IPv6 but it's broken (doesn't work) and if your first DNS nameserver is IPv6 (e.g. 2001:4860:4860::8888) and you're on macOS High Sierra (that's what I'm on; I don't know about other OSes/versions):

    cf api api.run.pivotal.io
    Setting api endpoint to api.run.pivotal.io...
    Request error: Get https://api.run.pivotal.io/v2/info: dial tcp: i/o timeout
    TIP: If you are behind a firewall and require an HTTP proxy, verify the https_proxy environment variable is correctly set. Else, check your network connection.

And here's the output of `tcpdump`; note that the lookups never fallback to using IPv4:

    sudo tcpdump -ni en0 port 53
    Password:
    tcpdump: verbose output suppressed, use -v or -vv for full protocol decode
    listening on en0, link-type EN10MB (Ethernet), capture size 262144 bytes
    10:56:44.436907 IP6 2001:4870:a2ce:1101:8438:ddac:d38f:704e.61647 > 2001:4860:4860::8888.53: 49963+ AAAA? api.run.pivotal.io. (36)
    10:56:44.436910 IP6 2001:4870:a2ce:1101:8438:ddac:d38f:704e.61648 > 2001:4860:4860::8888.53: 60917+ A? api.run.pivotal.io. (36)
    10:56:49.436910 IP6 2001:4870:a2ce:1101:8438:ddac:d38f:704e.61652 > 2001:4860:4860::8888.53: 20369+ AAAA? api.run.pivotal.io. (36)
    10:56:49.436915 IP6 2001:4870:a2ce:1101:8438:ddac:d38f:704e.61653 > 2001:4860:4860::8888.53: 50584+ A? api.run.pivotal.io. (36)
    10:57:16.868818 IP 10.80.130.88.57117 > 10.87.8.10.53: 3480+ A? csi.gstatic.com. (33)
